{
  "schema_version": "simworld.vista.playable-event/v1",
  "event_id": "mmg_013",
  "title": "Coffee carried past a slipper obstacle",
  "compatible_house": {"house_id": "home.r1", "revision": "vista_playable_home_r1", "content_digest": "51208e0ecc1ad1450ca6d9b14a4fb46989bff90fd8dc15422a0a47df6827c8c3"},
  "participating_room_ids": ["home.r1/room.kitchen_dining", "home.r1/room.living_room"],
  "participating_entity_ids": [
    "home.r1/room.kitchen_dining/entity.coffee_cup.01",
    "home.r1/room.living_room/entity.slipper.01",
    "home.r1/room.living_room/entity.spill_marker.01"
  ],
  "initial_operations": [
    {"op_id": "op.01", "op": "set_transform", "target_id": "home.r1/room.kitchen_dining/entity.coffee_cup.01", "room_id": "home.r1/room.kitchen_dining", "transform": {"location_m": [-0.55, -0.2, 0.78], "rotation_deg": [0, 0, 0], "scale": [1, 1, 1]}},
    {"op_id": "op.02", "op": "set_transform", "target_id": "home.r1/room.living_room/entity.slipper.01", "room_id": "home.r1/room.living_room", "transform": {"location_m": [1.4, -0.5, 0.03], "rotation_deg": [0, 0, 25], "scale": [1, 1, 1]}},
    {"op_id": "op.03", "op": "set_visibility", "target_id": "home.r1/room.living_room/entity.spill_marker.01", "visible": false},
    {"op_id": "op.04", "op": "set_goal", "goal_id": "clear_obstacle", "enabled": true}
  ],
  "public_goals": [
    {"goal_id": "clear_obstacle", "description": "Clear the slipper from the walking path before carrying the coffee through the living room.", "success_condition_ids": ["slipper_moved"]}
  ],
  "triggers": [
    {"condition_id": "coffee_picked_up", "type": "interaction", "target_id": "home.r1/room.kitchen_dining/entity.coffee_cup.01", "affordance": "pick_up"}
  ],
  "success_conditions": [
    {"condition_id": "slipper_moved", "type": "interaction", "target_id": "home.r1/room.living_room/entity.slipper.01", "affordance": "pick_up"}
  ],
  "failure_conditions": [
    {"condition_id": "spill_visible", "type": "entity_state", "target_id": "home.r1/room.living_room/entity.spill_marker.01", "field": "visible", "operator": "eq", "value": true}
  ],
  "timeout_s": 600,
  "reset_policy": {"mode": "restore_baseline", "reset_npc_queues": true, "release_held_items": true},
  "source": {"dataset": "VISTA", "sample_id": "mmg_013", "verification": "verified", "public_reference": "vista://assist-step/mmg_013"},
  "content_digest": "e9afea9e0e9eb79c1f38302d35602220e9b7ffd7ebd04cbfd062ce8752cbca77"
}
