{
  "schema_version": "simworld.vista.playable-event/v1",
  "event_id": "mmg_045",
  "title": "Phone left in the bedroom",
  "compatible_house": {"house_id": "home.r1", "revision": "vista_playable_home_r1", "content_digest": "b9674469c5ee7ca2315be1df7145dbef5527a38ee2a145f9f1e2ad5709b7ecb1"},
  "participating_room_ids": ["home.r1/room.bedroom", "home.r1/room.entry_hall"],
  "participating_entity_ids": [
    "home.r1/room.bedroom/entity.phone.01",
    "home.r1/room.entry_hall/entity.exit_door.01"
  ],
  "initial_operations": [
    {"op_id": "op.01", "op": "set_transform", "target_id": "home.r1/room.bedroom/entity.phone.01", "room_id": "home.r1/room.bedroom", "transform": {"location_m": [0.6, 1.2, 0.64], "rotation_deg": [0, 0, 10], "scale": [1, 1, 1]}},
    {"op_id": "op.02", "op": "set_portable", "target_id": "home.r1/room.bedroom/entity.phone.01", "portable": true},
    {"op_id": "op.03", "op": "set_goal", "goal_id": "bring_phone", "enabled": true}
  ],
  "public_goals": [
    {"goal_id": "bring_phone", "description": "Bring the phone from the bedroom to the entry before opening the exit door.", "success_condition_ids": ["phone_at_entry"]}
  ],
  "triggers": [
    {"condition_id": "player_reaches_entry", "type": "player_room", "room_id": "home.r1/room.entry_hall"}
  ],
  "success_conditions": [
    {"condition_id": "phone_at_entry", "type": "entity_room", "target_id": "home.r1/room.bedroom/entity.phone.01", "room_id": "home.r1/room.entry_hall"}
  ],
  "failure_conditions": [
    {"condition_id": "exit_opened_without_phone", "type": "interaction", "target_id": "home.r1/room.entry_hall/entity.exit_door.01", "affordance": "open"}
  ],
  "timeout_s": 600,
  "reset_policy": {"mode": "restore_baseline", "reset_npc_queues": true, "release_held_items": true},
  "source": {"dataset": "VISTA", "sample_id": "mmg_045", "verification": "verified", "public_reference": "vista://assist-step/mmg_045"},
  "content_digest": "b742cd40a22c5bfaef8883a53ac044c4d3d558a883d6df52a141e0cd1ea1bcd2"
}
