{
  "schema_version": "simworld.vista.playable-event/v1",
  "event_id": "mmg_070",
  "title": "Loaded washer has not been started",
  "compatible_house": {"house_id": "home.r1", "revision": "vista_playable_home_r1", "content_digest": "51208e0ecc1ad1450ca6d9b14a4fb46989bff90fd8dc15422a0a47df6827c8c3"},
  "participating_room_ids": ["home.r1/room.bathroom_laundry"],
  "participating_entity_ids": [
    "home.r1/room.bathroom_laundry/entity.clothes.01",
    "home.r1/room.bathroom_laundry/entity.washer.01"
  ],
  "initial_operations": [
    {"op_id": "op.01", "op": "set_state", "target_id": "home.r1/room.bathroom_laundry/entity.washer.01", "state_patch": {"active": false, "status": "loaded"}},
    {"op_id": "op.02", "op": "set_state", "target_id": "home.r1/room.bathroom_laundry/entity.clothes.01", "state_patch": {"status": "loaded"}},
    {"op_id": "op.03", "op": "set_goal", "goal_id": "start_washer", "enabled": true}
  ],
  "public_goals": [
    {"goal_id": "start_washer", "description": "Start the loaded washer before leaving the laundry area.", "success_condition_ids": ["washer_started"]}
  ],
  "triggers": [
    {"condition_id": "clothes_loaded", "type": "entity_state", "target_id": "home.r1/room.bathroom_laundry/entity.clothes.01", "field": "status", "operator": "eq", "value": "loaded"}
  ],
  "success_conditions": [
    {"condition_id": "washer_started", "type": "entity_state", "target_id": "home.r1/room.bathroom_laundry/entity.washer.01", "field": "active", "operator": "eq", "value": true}
  ],
  "failure_conditions": [
    {"condition_id": "washer_wait_timeout", "type": "elapsed", "operator": "gte", "seconds": 120}
  ],
  "timeout_s": 600,
  "reset_policy": {"mode": "restore_baseline", "reset_npc_queues": true, "release_held_items": true},
  "source": {"dataset": "VISTA", "sample_id": "mmg_070", "verification": "verified", "public_reference": "vista://assist-step/mmg_070"},
  "content_digest": "53e60f5bef042f3c3154b52d65ae8bd6c10d598f043535a9daada410f8bd715d"
}
