{
  "schema_version": "simworld.vista.playable-event/v1",
  "event_id": "mmg_044",
  "title": "Keys left in the living room",
  "compatible_house": {"house_id": "home.r1", "revision": "vista_playable_home_r1", "content_digest": "b9674469c5ee7ca2315be1df7145dbef5527a38ee2a145f9f1e2ad5709b7ecb1"},
  "participating_room_ids": ["home.r1/room.entry_hall", "home.r1/room.living_room"],
  "participating_entity_ids": [
    "home.r1/room.entry_hall/entity.exit_door.01",
    "home.r1/room.living_room/entity.keys.01"
  ],
  "initial_operations": [
    {"op_id": "op.01", "op": "set_transform", "target_id": "home.r1/room.living_room/entity.keys.01", "room_id": "home.r1/room.living_room", "transform": {"location_m": [-0.35, 0.3, 0.5], "rotation_deg": [0, 0, 15], "scale": [1, 1, 1]}},
    {"op_id": "op.02", "op": "set_portable", "target_id": "home.r1/room.living_room/entity.keys.01", "portable": true},
    {"op_id": "op.03", "op": "set_goal", "goal_id": "bring_keys", "enabled": true}
  ],
  "public_goals": [
    {"goal_id": "bring_keys", "description": "Bring the keys from the living room to the entry before opening the exit door.", "success_condition_ids": ["keys_at_entry"]}
  ],
  "triggers": [
    {"condition_id": "player_at_entry", "type": "player_room", "room_id": "home.r1/room.entry_hall"}
  ],
  "success_conditions": [
    {"condition_id": "keys_at_entry", "type": "entity_room", "target_id": "home.r1/room.living_room/entity.keys.01", "room_id": "home.r1/room.entry_hall"}
  ],
  "failure_conditions": [
    {"condition_id": "exit_opened_without_keys", "type": "interaction", "target_id": "home.r1/room.entry_hall/entity.exit_door.01", "affordance": "open"}
  ],
  "timeout_s": 600,
  "reset_policy": {"mode": "restore_baseline", "reset_npc_queues": true, "release_held_items": true},
  "source": {"dataset": "VISTA", "sample_id": "mmg_044", "verification": "verified", "public_reference": "vista://assist-step/mmg_044"},
  "content_digest": "66bdc5d6497ef04ff8c4739f0cb8cd01f17d46f65777183c947470da54503023"
}
